commit	val_bpb	memory_gb	status	description
9be701e	2.319		discard	EMBEDDING_LR 2.0 too high (2.319 vs 2.232)
bc6aaab	2.239		discard	EMBEDDING_LR 1.8 worse (2.239 vs 2.232)
28ac8f7	2.236		discard	MATRIX_LR 0.025 worse (2.236 vs 2.232)
536c554	2.254		discard	UNEMBEDDING_LR 0.006 worse (2.254 vs 2.232)
7688b29	2.264		discard	UNEMBEDDING_LR 0.01 much worse (2.264 vs 2.232)
d690b1e	2.422		discard	TOTAL_BATCH_SIZE 2^15 much worse (2.422 vs 2.232, 27 steps)
d2ffe5c	2.227		discard	skip MLP last 4 layers too aggressive (2.227 vs 2.225)
6de1373	2.226		discard	skip MLP in first+last 3 slightly worse (2.226 vs 2.225)
df83e7f	2.244		discard	lm_head init std 0.002 worse (2.244 vs 2.225)
d6a166a	2.229		discard	GELU worse than SiLU (2.229 vs 2.225)
fedb92c	2.244		discard	x0_lambda 0.15 worse (2.244 vs 2.225)
9704e0f	2.2254		discard	RoPE base 50000 no improvement (2.2254 vs 2.2249)
0a7624f	2.084960	0.7	keep	MLP ratio taper: 1.5x hidden in first 4 layers (run 305)
01cb068	2.118102	0.7	discard	Added torch.cuda.synchronize() before evaluate_bpb to fix eval hang (run 308)
9156f77	2.164102	0.7	discard	GELU activation worse than SiLU (2.164 vs 2.085)
b4m5q7n9	2.125909	0.7	discard	Skip MLP in last 5 layers (worse than 4)
bj1u7c9d	2.162664	0.7	discard	MLP taper 1.5x in first 5 layers (worse than 4)
e1e45ca	2.172829	2.5	discard	EMBEDDING_LR=1.2 with EVAL_TOKENS=500K monkeypatch
3327d22	0.0	0.0	crash	Run 320: Baseline retest - TIMEOUT at training step 60/~230 (EVAL_TOKENS=1M too slow, no val_bpb)
b60e25e	0.0	0.0	crash	Run 321: TIMEOUT at step 31/~230 (EVAL_TOKENS=500K still too slow, timing issue persists)
43b01c5	0.0	0.0	crash	Run 322: AssertionError - TOTAL_BATCH_SIZE not divisible by tokens_per_fwdbwd (batch config mismatch)
1c59180	0.0	0.0	crash	Run 323: TIMEOUT at step 65/~79 (82.6% complete, batch size helped but eval still slow)
831bc97	0.0	0.0	crash	Run 324: TIMEOUT at step 22/~79 (timing regressed, hardware variance)
0efa186	0.0	0.0	crash	Run 325: First step 61.9s timeout (DEPTH scaling changed model dims unexpectedly)
6b4671c	0.0	0.0	crash	Run 326: First step 190.5s overhead, timeout at step 15/~79
e582862	0.0	0.0	crash	Run 327: Timeout at step 21/~220 (19.6%, per-step ~5.9s, need eval reduction)
ccd32c6	0.0	0.0	crash	Run 328: Timeout at step 13/~100 (EVAL_TOKENS=100K still insufficient, need faster per-step)
7084dfe	0.0	0.0	crash	Run 329: BREAKTHROUGH - reached step 101, achieved 1.19s/step (45.9%), hit 600s timeout before eval
ba45ula2o	0.0	0.0	crash	Run 330: Reached step 107/~260 (42.4%), sustained 1.19s/step, but 800s still insufficient - need eval time
8530c4a	2.114396	1.4	keep	Run 332: Infrastructure fix - extended TIME_BUDGET to 360s for full training+eval (284 steps)
9806daf	2.058646	1.4	keep	Run 333: Skip MLP in last 3 layers (356 steps, +0.056 improvement over baseline)
9659f27	2.066134	1.4	keep	Run 334: Skip MLP in last 5 layers (332 steps, slightly worse than skip-3)
745f5fc	2.097976	1.4	discard	Run 335: Skip MLP in last 2 layers (worse than skip-3)
0879a99	2.196567	1.4	discard	Run 336: MLP ratio 1.4x (worse than 1.5x baseline)
c46b6b5	2.221767	1.4	discard	Run 337: MLP ratio 1.6x (worse than 1.5x baseline)
2208f29	2.102663	1.4	discard	Run 338: MLP ratio 1.7x (worse than 1.5x baseline)
3b0b8ca	2.096720	1.4	discard	Run 339: EMBEDDING_LR 1.1 (worse than baseline 1.2)
2c10a38	2.102809	1.4	discard	Run 340: EMBEDDING_LR 1.3
2c10a38	2.102760	1.4	discard	Run 341: SCALAR_LR 0.15
2c10a38	2.101578	1.4	discard	Run 342: SCALAR_LR 0.25
2c10a38	2.104800	1.4	discard	Run 343: EMA_DECAY 0.90
2c10a38	2.114764	1.4	discard	Run 344: EMA_DECAY 0.94
845f059	2.016154	1.4	discard	Run 345: DEPTH=8
845f059	2.016154	1.2	keep	Run 345: DEPTH=8 - BREAKTHROUGH improvement (2.059->2.016, +2.1%)
845f059	2.295765	1.4	discard	Run 346: DEPTH=10
0379b9a	2.295765	1.4	discard	Run 346: DEPTH=10 - much worse (deeper is bad)
845f059	2.447386	1.4	discard	Run 347: DEPTH=11
da323ed	2.447386	1.4	discard	Run 347: DEPTH=11 - even worse
5848db3	1.966880	1.2	keep	Run 348: DEPTH=7 - NEW BEST! (1.967, +3.9% vs 2.016)
87b0b33	1.906494	1.2	keep	Run 349: DEPTH=6 - NEW BEST! (1.906, +3.0% vs 1.967)
f230ff3	1.869131	1.1	keep	Run 350: DEPTH=5 - NEW BEST! (1.869, +2.0% vs 1.906)
bac3169	1.830068	1.1	keep	Run 351: DEPTH=4 - NEW BEST! (1.830, +1.7% vs 1.869)
ec5f607	1.817527	1.0	keep	Run 352: DEPTH=3 - NEW BEST! (1.818, +0.7% vs 1.830)
8adbb25	1.832167	0.9	discard	Run 353: DEPTH=2 - DEGRADATION (1.832 vs 1.818), capacity limit hit
7a2d576	1.812980	1.1	keep	Run 354: Phase 5 - MLP at all layers (+0.2% vs pure attn)
667d928	1.815836	1.1	discard	Run 355: MLP 1.25x - worse than 1.5x
3108967	1.843979	1.1	keep	Run 360: DEPTH=3 baseline with 25K eval tokens (OOM resolved)
1a5aa3c	1.845933	1.1	discard	Run 361: MLP 1.75x - tied with 1.5x, confirms pure-attention optimal
6736203	1.846904	1.1	discard	Run 362: EMBEDDING_LR 1.0 - worse than 1.2
